{
  "artifact_type": "delegation_edge_v1",
  "schema_version": "1.0.0",
  "protocol_version": "1.0",
  "agreement_id": "agr-phase2-parent",
  "revision_id": "rev-phase2-parent",
  "edge_id": "edge-phase2-001",
  "parent_revision_id": "rev-phase2-parent",
  "child_agreement_id": "agr-phase2-child",
  "child_revision_id": "rev-phase2-child",
  "parent_subject_ref": "subject:provider-parent",
  "child_subject_ref": "subject:provider-child",
  "created_at": "2026-03-19T02:04:00Z"
}
